{"$schema":"https://json-schema.org/draft/2020-12/schema","$id":"asset-review.schema.json","title":"asset-review","type":"object","additionalProperties":false,"required":["schema_version","review_id","code","severity","object_id","candidate_id","relation_id","reason","evidence","locator","status","rule_id","rule_version"],"properties":{"schema_version":{"const":"1.0.0"},"review_id":{"type":"string"},"code":{"type":"string"},"severity":{"enum":["info","warning","error"]},"object_id":{"type":["string","null"]},"candidate_id":{"type":["string","null"]},"relation_id":{"type":["string","null"]},"reason":{"type":"string"},"evidence":{"type":"object"},"locator":{"type":["string","null"]},"status":{"const":"pending"},"rule_id":{"type":"string"},"rule_version":{"const":"asset-validation-v1"}}}
